{
  "course_slug": "system-design",
  "slug": "password-change-sessions",
  "title": "A password change that leaves an old phone active",
  "hook": "You change your password, but your other phone can still like, comment and send messages. How should the service log it out?",
  "context": "Consumer app with three phone sessions and stateless API workers",
  "tier": "foundations",
  "concept_ids": [
    "session-revocation",
    "token-validation"
  ],
  "estimated_minutes": 7,
  "status": "live",
  "solution_brief": "Issue a separate opaque session or token identifier per device. On password change, revoke the other session IDs in an authoritative store. Check revocation on protected requests; a short cache TTL trades read load for a bounded stale window.",
  "steps": [
    {
      "kind": "initial",
      "step_type": "design_choice",
      "prompt": "Where should the server keep revocable session identity?",
      "options": [
        {
          "id": "a",
          "text": "A distinct session ID per login in a server-side store"
        },
        {
          "id": "b",
          "text": "Only an expiry timestamp inside each signed token"
        },
        {
          "id": "c",
          "text": "The latest password hash in browser storage"
        }
      ],
      "correct_option_id": "a",
      "explanation": "A allows selective revocation. B remains valid until expiry even after a password change. C is client-controlled and cannot revoke another phone.",
      "bottleneck_note": "A signed token proves issuance, not that the session is still allowed.",
      "concept_ids": [
        "session-revocation"
      ]
    },
    {
      "kind": "probe",
      "step_type": "tradeoff",
      "prompt": "The user has three phones and wants only the stolen one logged out. What changes?",
      "options": [
        {
          "id": "a",
          "text": "Revoke that phone\u2019s session ID while retaining the other two"
        },
        {
          "id": "b",
          "text": "Rotate one global signing key for every user"
        },
        {
          "id": "c",
          "text": "Clear the stolen phone\u2019s local storage remotely"
        }
      ],
      "correct_option_id": "a",
      "explanation": "A targets one session. B invalidates every user and is operationally costly. C cannot reliably reach an offline or hostile device.",
      "bottleneck_note": "Revocation granularity must match the product action.",
      "concept_ids": [
        "session-revocation"
      ],
      "context_note": "One phone is reported stolen; the other two are trusted."
    },
    {
      "kind": "probe",
      "step_type": "design_choice",
      "prompt": "At 1000 authenticated requests per second, how should workers check revocation?",
      "options": [
        {
          "id": "a",
          "text": "Check a short-lived shared cache backed by the authoritative session store"
        },
        {
          "id": "b",
          "text": "Trust the token until its hour-long expiry"
        },
        {
          "id": "c",
          "text": "Read the password table with a full scan on every request"
        }
      ],
      "correct_option_id": "a",
      "explanation": "A reduces store reads and bounds staleness by TTL. B leaves the stolen phone active for up to an hour. C makes the hot path unnecessarily expensive.",
      "bottleneck_note": "Cache expiry is part of the security promise.",
      "concept_ids": [
        "token-validation"
      ],
      "context_note": "Each request now needs a revocation decision."
    },
    {
      "kind": "probe",
      "step_type": "tradeoff",
      "prompt": "A cache entry lives for 30 seconds. What is the worst ordinary stale window after revocation?",
      "options": [
        {
          "id": "a",
          "text": "About 30 seconds unless entries are actively invalidated"
        },
        {
          "id": "b",
          "text": "Zero seconds because the database row is gone"
        },
        {
          "id": "c",
          "text": "One hour because signed tokens cannot be checked"
        }
      ],
      "correct_option_id": "a",
      "explanation": "A follows directly from the TTL. B ignores stale cache entries. C ignores the revocation lookup; token expiry is a separate bound.",
      "bottleneck_note": "State the stale window explicitly in the design.",
      "concept_ids": [
        "token-validation"
      ],
      "context_note": "The team proposes a 30-second cache TTL."
    },
    {
      "kind": "probe",
      "step_type": "design_choice",
      "prompt": "The revoke operation writes asynchronously. When may the UI say \u201clogged out\u201d?",
      "options": [
        {
          "id": "a",
          "text": "After the revocation write is durable; invalidate caches if immediate effect is promised"
        },
        {
          "id": "b",
          "text": "As soon as the queue accepts the job"
        },
        {
          "id": "c",
          "text": "Only after the old phone reconnects and acknowledges"
        }
      ],
      "correct_option_id": "a",
      "explanation": "A ties the claim to enforcement. B can leave the old phone posting while the queue waits or fails. C gives an attacker veto power over completion.",
      "bottleneck_note": "Do not claim immediate logout before the enforcement path changes.",
      "concept_ids": [
        "session-revocation",
        "token-validation"
      ],
      "context_note": "Product wants a confirmation banner after the password change."
    }
  ]
}
